{
  "schema_version": 1,
  "bundle_id": "CURRENT_TEST_VEHICLE_PHASE3D_IDENTIFICATION_2026_08_09",
  "example_only": false,
  "profile_ref": "../profiles/current-test-vehicle.vehicle-profile.json",
  "evidence_index": "../evidence/current-test-vehicle.evidence-index.json",
  "recorded_at": "2026-08-09T18:39:03+02:00",
  "observations": [
    {"observation_id":"vehicle.model","category":"IDENTIFICATION","qualification":"CONFIRMED","precondition_eligibility":"PROHIBITED","source":{"tool":"ISTA","sgbd_prg":null,"job":null,"field":"Vehicle","physical_context":"Current test vehicle identification","observed_at":"2026-08-09T18:39:03+02:00","session":"PHASE3D_USER_REPORT_2026_08_09","evidence_ref":"CURRENT_TEST_VEHICLE_PHASE3D_IDENTIFICATION_STATUS_2026_08_09"},"raw_value":"BMW E90 sedan","interpreted_value":"BMW E90 sedan","unit":null,"notes":null},
    {"observation_id":"vehicle.engine","category":"IDENTIFICATION","qualification":"CONFIRMED","precondition_eligibility":"PROHIBITED","source":{"tool":"ISTA","sgbd_prg":"D71N47C0.PRG","job":null,"field":"Engine","physical_context":"Current test vehicle identification","observed_at":"2026-08-09T18:39:03+02:00","session":"PHASE3D_USER_REPORT_2026_08_09","evidence_ref":"CURRENT_TEST_VEHICLE_PHASE3D_IDENTIFICATION_STATUS_2026_08_09"},"raw_value":"N47","interpreted_value":"N47","unit":null,"notes":null},
    {"observation_id":"vehicle.transmission","category":"IDENTIFICATION","qualification":"CONFIRMED","precondition_eligibility":"PROHIBITED","source":{"tool":"ISTA","sgbd_prg":"GS19D.PRG","job":null,"field":"Transmission","physical_context":"Current test vehicle identification","observed_at":"2026-08-09T18:39:03+02:00","session":"PHASE3D_USER_REPORT_2026_08_09","evidence_ref":"CURRENT_TEST_VEHICLE_PHASE3D_IDENTIFICATION_STATUS_2026_08_09"},"raw_value":"automatic","interpreted_value":"automatic","unit":null,"notes":null},
    {"observation_id":"vehicle.ista_date","category":"IDENTIFICATION","qualification":"CONFIRMED","precondition_eligibility":"PROHIBITED","source":{"tool":"ISTA","sgbd_prg":null,"job":null,"field":"Vehicle date","physical_context":"Current test vehicle identification","observed_at":"2026-08-09T18:39:03+02:00","session":"PHASE3D_USER_REPORT_2026_08_09","evidence_ref":"CURRENT_TEST_VEHICLE_PHASE3D_IDENTIFICATION_STATUS_2026_08_09"},"raw_value":"2008/09","interpreted_value":"2008/09","unit":null,"notes":"ISTA vehicle date, distinct from ECU production dates."},

    {"observation_id":"cas.sgbd","category":"IDENTIFICATION","qualification":"CONFIRMED","precondition_eligibility":"PROHIBITED","source":{"tool":"Tool32","sgbd_prg":"CAS.PRG","job":null,"field":"SGBD","physical_context":"CAS identification","observed_at":"2026-08-09T18:39:03+02:00","session":"PHASE3D_USER_REPORT_2026_08_09","evidence_ref":"CURRENT_TEST_VEHICLE_PHASE3D_IDENTIFICATION_STATUS_2026_08_09"},"raw_value":"CAS.PRG","interpreted_value":"CAS.PRG","unit":null,"notes":null},
    {"observation_id":"cas.bus","category":"IDENTIFICATION","qualification":"CONFIRMED","precondition_eligibility":"PROHIBITED","source":{"tool":"ISTA","sgbd_prg":"CAS.PRG","job":null,"field":"Bus","physical_context":"CAS identification","observed_at":"2026-08-09T18:39:03+02:00","session":"PHASE3D_USER_REPORT_2026_08_09","evidence_ref":"CURRENT_TEST_VEHICLE_PHASE3D_IDENTIFICATION_STATUS_2026_08_09"},"raw_value":"K-CAN","interpreted_value":"K-CAN","unit":null,"notes":null},
    {"observation_id":"cas.bmw_part_number","category":"IDENTIFICATION","qualification":"CONFIRMED","precondition_eligibility":"PROHIBITED","source":{"tool":"ISTA","sgbd_prg":"CAS.PRG","job":null,"field":"BMW part number","physical_context":"CAS identification","observed_at":"2026-08-09T18:39:03+02:00","session":"PHASE3D_USER_REPORT_2026_08_09","evidence_ref":"CURRENT_TEST_VEHICLE_PHASE3D_IDENTIFICATION_STATUS_2026_08_09"},"raw_value":"9147226","interpreted_value":"9147226","unit":null,"notes":"Not assumed to be a ZB number."},
    {"observation_id":"cas.coding_index","category":"IDENTIFICATION","qualification":"CONFIRMED","precondition_eligibility":"PROHIBITED","source":{"tool":"ISTA","sgbd_prg":"CAS.PRG","job":null,"field":"Coding index","physical_context":"CAS identification","observed_at":"2026-08-09T18:39:03+02:00","session":"PHASE3D_USER_REPORT_2026_08_09","evidence_ref":"CURRENT_TEST_VEHICLE_PHASE3D_IDENTIFICATION_STATUS_2026_08_09"},"raw_value":9,"interpreted_value":9,"unit":null,"notes":null},
    {"observation_id":"cas.diagnosis_index","category":"IDENTIFICATION","qualification":"CONFIRMED","precondition_eligibility":"PROHIBITED","source":{"tool":"ISTA","sgbd_prg":"CAS.PRG","job":null,"field":"Diagnosis index","physical_context":"CAS identification","observed_at":"2026-08-09T18:39:03+02:00","session":"PHASE3D_USER_REPORT_2026_08_09","evidence_ref":"CURRENT_TEST_VEHICLE_PHASE3D_IDENTIFICATION_STATUS_2026_08_09"},"raw_value":1696,"interpreted_value":1696,"unit":null,"notes":null},
    {"observation_id":"cas.function_software","category":"IDENTIFICATION","qualification":"CONFIRMED","precondition_eligibility":"PROHIBITED","source":{"tool":"ISTA","sgbd_prg":"CAS.PRG","job":null,"field":"Function software","physical_context":"CAS identification","observed_at":"2026-08-09T18:39:03+02:00","session":"PHASE3D_USER_REPORT_2026_08_09","evidence_ref":"CURRENT_TEST_VEHICLE_PHASE3D_IDENTIFICATION_STATUS_2026_08_09"},"raw_value":"2.4.8","interpreted_value":"2.4.8","unit":null,"notes":null},
    {"observation_id":"cas.hardware_number","category":"IDENTIFICATION","qualification":"CONFIRMED","precondition_eligibility":"PROHIBITED","source":{"tool":"ISTA","sgbd_prg":"CAS.PRG","job":null,"field":"Hardware number","physical_context":"CAS identification","observed_at":"2026-08-09T18:39:03+02:00","session":"PHASE3D_USER_REPORT_2026_08_09","evidence_ref":"CURRENT_TEST_VEHICLE_PHASE3D_IDENTIFICATION_STATUS_2026_08_09"},"raw_value":"C4","interpreted_value":"C4","unit":null,"notes":null},
    {"observation_id":"cas.operating_software","category":"IDENTIFICATION","qualification":"CONFIRMED","precondition_eligibility":"PROHIBITED","source":{"tool":"ISTA","sgbd_prg":"CAS.PRG","job":null,"field":"Operating software","physical_context":"CAS identification","observed_at":"2026-08-09T18:39:03+02:00","session":"PHASE3D_USER_REPORT_2026_08_09","evidence_ref":"CURRENT_TEST_VEHICLE_PHASE3D_IDENTIFICATION_STATUS_2026_08_09"},"raw_value":"3.3.0","interpreted_value":"3.3.0","unit":null,"notes":null},
    {"observation_id":"cas.production_date","category":"IDENTIFICATION","qualification":"CONFIRMED","precondition_eligibility":"PROHIBITED","source":{"tool":"ISTA","sgbd_prg":"CAS.PRG","job":null,"field":"Production date","physical_context":"CAS identification","observed_at":"2026-08-09T18:39:03+02:00","session":"PHASE3D_USER_REPORT_2026_08_09","evidence_ref":"CURRENT_TEST_VEHICLE_PHASE3D_IDENTIFICATION_STATUS_2026_08_09"},"raw_value":"04.02.2009","interpreted_value":"2009-02-04","unit":null,"notes":null},
    {"observation_id":"cas.supplier","category":"IDENTIFICATION","qualification":"CONFIRMED","precondition_eligibility":"PROHIBITED","source":{"tool":"ISTA","sgbd_prg":"CAS.PRG","job":null,"field":"Supplier","physical_context":"CAS identification","observed_at":"2026-08-09T18:39:03+02:00","session":"PHASE3D_USER_REPORT_2026_08_09","evidence_ref":"CURRENT_TEST_VEHICLE_PHASE3D_IDENTIFICATION_STATUS_2026_08_09"},"raw_value":"Siemens","interpreted_value":"Siemens","unit":null,"notes":null},
    {"observation_id":"cas.variant_index","category":"IDENTIFICATION","qualification":"CONFIRMED","precondition_eligibility":"PROHIBITED","source":{"tool":"ISTA","sgbd_prg":"CAS.PRG","job":null,"field":"Variant index","physical_context":"CAS identification","observed_at":"2026-08-09T18:39:03+02:00","session":"PHASE3D_USER_REPORT_2026_08_09","evidence_ref":"CURRENT_TEST_VEHICLE_PHASE3D_IDENTIFICATION_STATUS_2026_08_09"},"raw_value":21313,"interpreted_value":21313,"unit":null,"notes":null},

    {"observation_id":"egs.sgbd","category":"IDENTIFICATION","qualification":"CONFIRMED","precondition_eligibility":"PROHIBITED","source":{"tool":"Tool32","sgbd_prg":"GS19D.PRG","job":null,"field":"SGBD","physical_context":"EGS identification","observed_at":"2026-08-09T18:39:03+02:00","session":"PHASE3D_USER_REPORT_2026_08_09","evidence_ref":"CURRENT_TEST_VEHICLE_PHASE3D_IDENTIFICATION_STATUS_2026_08_09"},"raw_value":"GS19D.PRG","interpreted_value":"GS19D.PRG","unit":null,"notes":null},
    {"observation_id":"egs.bus","category":"IDENTIFICATION","qualification":"CONFIRMED","precondition_eligibility":"PROHIBITED","source":{"tool":"ISTA","sgbd_prg":"GS19D.PRG","job":null,"field":"Bus","physical_context":"EGS identification","observed_at":"2026-08-09T18:39:03+02:00","session":"PHASE3D_USER_REPORT_2026_08_09","evidence_ref":"CURRENT_TEST_VEHICLE_PHASE3D_IDENTIFICATION_STATUS_2026_08_09"},"raw_value":"PT-CAN","interpreted_value":"PT-CAN","unit":null,"notes":null},
    {"observation_id":"egs.bmw_part_number","category":"IDENTIFICATION","qualification":"CONFIRMED","precondition_eligibility":"PROHIBITED","source":{"tool":"ISTA","sgbd_prg":"GS19D.PRG","job":null,"field":"BMW part number","physical_context":"EGS identification","observed_at":"2026-08-09T18:39:03+02:00","session":"PHASE3D_USER_REPORT_2026_08_09","evidence_ref":"CURRENT_TEST_VEHICLE_PHASE3D_IDENTIFICATION_STATUS_2026_08_09"},"raw_value":"7591971","interpreted_value":"7591971","unit":null,"notes":null},
    {"observation_id":"egs.coding_index","category":"IDENTIFICATION","qualification":"CONFIRMED","precondition_eligibility":"PROHIBITED","source":{"tool":"ISTA","sgbd_prg":"GS19D.PRG","job":null,"field":"Coding index","physical_context":"EGS identification","observed_at":"2026-08-09T18:39:03+02:00","session":"PHASE3D_USER_REPORT_2026_08_09","evidence_ref":"CURRENT_TEST_VEHICLE_PHASE3D_IDENTIFICATION_STATUS_2026_08_09"},"raw_value":5,"interpreted_value":5,"unit":null,"notes":null},